"screen_name","content","mentions"
"@abu_hanifah1442","Cage ≠ CAIR \nCage &gt; CAIR\n\nCage = heroes\nCAIR = opportunist paindoos that support non binary Muppets, cve, and other… https://t.co/1eVgfPNnBq",""
"@_FirehaK","With the final payload for #Egregor publicly available on VT, ""loader"" tags have been added to most previous upload… https://t.co/zeZkYNHFEx",""
"@aicanedo","5 Must-Have #DataScience Skills That You Should Learn.\nhttps://t.co/nWcGyPYlh7 #MachineLearning #DataScience… https://t.co/whMqfYXLF0",""
"@three_cube","Linux Basics for Hackers, Part 2: Finding Stuff in Linux #linux #linuxbasics #linux4hackers #cybersecurity… https://t.co/TofL0Xu8Sk",""
"@AlyssaM_InfoSec","@Coleens_IS Girl, been right there with you and those tears. Its so hard to believe but yes, the chapter of the las… https://t.co/xMpUFwwJ6o","@Coleens_IS"
"@JacquiHeinrich","From the director of the Cybersecurity and Infrastructure Agency, a division of the Dept of Homeland Security https://t.co/Dq0f60mB37",""
"@JerryDunleavy","Director of DHS's Cybersecurity &amp; Infrastructure Agency\n\nhttps://t.co/kBzJ4T8zi8 https://t.co/J9AD4ZP3dq",""
"@InfoSecHotSpot","Trump’s Cybersecurity Agency Says It Is 'Highly Difficult' to Commit Voter Fraud, Actually Despite the president’s… https://t.co/x1eJ7o9rPq",""
"@infosec_au","https://t.co/wq9k3rB8T0",""
"@digitalcloudgal","📌 Okay my #cybersecurity friends, here is a solid, tangible path forward to a #Ciso role with real world references… https://t.co/qLdFfE1ok1",""
"@ChuckRobbins","@Cisco is eager to work with the new Administration &amp; Congress to strengthen digital infrastructure to help busines… https://t.co/odqc6etH8u","@Cisco"
"@Neuromorph","Google open-sources MT5, a multilingual model trained on over 101 languages.\n\nhttps://t.co/P4h4VWLve0… https://t.co/pd5t4tw3Fm",""
"@three_cube","Vault 7 Reveals that Even the CIA Reverse Engineers Malware for Reuse #reversing #cia #reverseengineering… https://t.co/RWwWTCvfVS",""
"@Ali_H_Soufan","This an important warning from the Director of the Cybersecurity and Infrastructure Security Agency👇🏼 https://t.co/0hsg36eTuX",""
"@InfoSec_MH","@Cernovich ""Trust Barr""\n""4D Chess""\n""keep your enemies close""\n""trust Wray""\n""trust Durham""\n""trust Sessions""\n""you know… https://t.co/sGFr8Xw22u","@Cernovich"
"@politicallands1","@Lcars24 @ZeroFuelEnviro Yes. It's remarkable he was able to keep us essentially defenseless w/20 intel agencies un… https://t.co/oSmRHxTl6E","@Lcars24|@ZeroFuelEnviro"
"@MarcoCiappelli","This is a BIG FAT NOPE!\n\nNO “Thougth Police”\n \n“The family had become in effect an extension of the Thought Police.… https://t.co/xOdZ9lXXp2",""
"@Daniel_Infosec","@DanielMiessler The right has been dragging the left so far that our left is middle right in other political spectrums.","@DanielMiessler"
"@AlyssaM_InfoSec","OMG my neighbors rock!!! Neighbor next door just dropped these off on my front porch table!! https://t.co/QMAFG05rq9",""
"@Sekurak","Hej admini! (i użytkownicy) Lepiej łatajcie ASAP Wasze instancje VMware. Grupa ransomware wykorzystuje podatność kl… https://t.co/fXSuwUl9EN",""
"@AlyssaM_InfoSec","So apparently @AndrewYang didn't get the message that fat shaming, even your most bitter rivals, is just not OK. Gl… https://t.co/P1OnKEuQ6C","@AndrewYang"
"@jonrlindsay","Everybody needs to read this book. Not just cyber policy people. Everybody. It is full of fresh ideas in clear pros… https://t.co/BHZMFUn6ei",""
"@SourabhSKatoch","73 Examples to Help You Master Python's f-strings.\n\nhttps://t.co/OfvzMOJbON\n\n#Python #MachineLearning #AI… https://t.co/VltQr1Mu1X",""
"@SaimaRa52073090","https://t.co/vwmSxTEsIt Get hired me as your #math assistant on #Fiverr #maths\n #100DaysOfCode #Machinelearning… https://t.co/H7kwxS0YYA",""
"@Hakin9","n this video you will learn how to perform ICMP analysis in Wireshark. Eavesdropping on ICMP traffic can provide a… https://t.co/o094Myqppg",""
"@AlyssaM_InfoSec","Stuck in quarantine, craving donuts. No donuts in the house. So sad. https://t.co/WrE1BqToOO",""
"@ingliguori","The TOP 5 #DigitalTransformation Framework in 2020 https://t.co/pTPDfHELCl via @ingliguori #Cloud #MachineLearning… https://t.co/dL0S2fSuRs","@ingliguori"
"@PenTestMag","How to Prepare and Use Docker for Web Pentest\n\nhttps://t.co/o4UwsEbNUy\n\n#pentest #magazine #pentestmag #pentestblog… https://t.co/yu6hujkE0E",""
"@KevinClarity","Quantum Computing: What Does It Mean For AI (Artificial Intelligence)?\n\n#Machinelearning #100DaysOfCode #IoT #IIoT… https://t.co/UVxCh9uu68",""
"@fadumzz","This man was leading cybersecurity efforts for the country.. https://t.co/vuzmiZDVBv",""
"@olivier_boschko","I was part of the #HTBAcademy #Beta Test! My favorite module is #Intro to #JavaScript #Deobfuscation Its a great in… https://t.co/o9IEoxu4ho",""
"@blueteamsec1","Welcome to ThreatPursuit VM: A Threat Intelligence and Hunting Virtual Machine https://t.co/77FxByoZDz #cyber #threathunting #infosec",""
"@Umberto_Rapetto","🥃 *APERI-HACKER* 🥃\ni pirati informatici si sono bevuti #Campari, l'aperitivo senza etichetta e senza protezioni inf… https://t.co/Ed0d46cLve",""
"@ipfconline1","What Is Quantum Supremacy And #QuantumComputing? (And How Excited Should We Be?)\nhttps://t.co/nDkYTJGwjR… https://t.co/wGv5cXJykf",""
"@rockreborn22","@InfoSec_MH @Cernovich Wray being the absolute worst. Trump literally appointed the guy who sat on Hunter’s laptop through impeachment.","@InfoSec_MH|@Cernovich"
"@Hazmat25","@InfoSec_MH @Cernovich Lincoln did the same thing.  Last time I checked you need senate confirmation for most posit… https://t.co/NwIqUB0Tfm","@InfoSec_MH|@Cernovich"
"@WIREDScience","Plus: Ransomware hits Capcom, the US seizes Iranian domains, and more of the week's top security news. https://t.co/6ZzIbIU4LG",""
"@javutin","I guess this can be considered #RedTeamFit ? #Cybersecurity https://t.co/5ndgjGPsDz",""
"@InfoSec_MH","@Cernovich From a guy who loves Trump (me):\n\nJust for the fact that he hired (AND KEPT) almost exclusively DC swamp… https://t.co/2dKHNcn43Q","@Cernovich"
"@remonsec","Hello hunters \n@naglinagli shared an amazing blog post about his finding.\n\nI suggest you all to have a look. I beli… https://t.co/hEV8lADy4u","@naglinagli"
"@AlyssaM_InfoSec","Tweet of the decade!! https://t.co/esuaHk3Z3u",""
"@AOAforDOs","The @FBI and other agencies warn of imminent cyberattacks on U.S. hospitals and health care providers. This threat… https://t.co/PxOvKioDYE","@FBI"
"@cynthiamckinney","Cybersecurity and Infrastructure Security Agency: Created November 2018 https://t.co/S0kKsV5jxC",""
"@5w0rdFish","When I started my InfoSec journey I never thought that one day I would be on a panel with these guys.  Life milesto… https://t.co/8nTTPZTAWB",""
"@nbstv","Fighting cybersecurity is still a challenge in Uganda, with most Ugandans, firms, organizations, and government age… https://t.co/wzQv96j3md",""
"@Hakin9","Web Applications Hacking contains two different editions that offer information on various attacks and approaches f… https://t.co/NGGlHSZumG",""
"@IdeaGov","As I have been hinting at, now that America will no longer have a traitor and quislings in power, my twitter tl wil… https://t.co/FxdtSluEsx",""
"@MorningTick","WhatsApp users in Oman speak out against hacking https://t.co/Tla9i421OW\n\n#Whatsapp #Oman #Hacked #Cybersecurity… https://t.co/RwoUboxaR9",""
"@THT_Resmi","Modern savaş robotları!\n\n#cybersecurity #cyber #security #cyberpunk #network #savaş #robot #artificialintelligence… https://t.co/u3PNZlDzlo",""
"@ITSPmagazine","Hosts @AlyssaM_InfoSec, @ChloeMessdaghi, &amp; @PhillipWylie took very non-traditional paths that led them to join the… https://t.co/1xYRSZU78q","@AlyssaM_InfoSec|@ChloeMessdaghi|@PhillipWylie"
"@bad_packets","Exploit activity detected from 217.8.117.137 (🇷🇺) targeting MobileIron MDM servers vulnerable to CVE-2020-15505 (… https://t.co/1bCjNEJtUa",""
"@u0pattern","وش أكثر شي يزعجك في الأمن السيبراني ؟ — معاملة Cybersecurity على أنه قاعة ""زوجوه يعقل"", مدري متى تفهم الناس ان هذا… https://t.co/YW2tLhc3IG",""
"@Udemy_Coupons1","Cybersecurity Awareness Training | 100%FREE #udemycoupon https://t.co/5LEk8RjGAq\n\n#MachineLearning #BigData… https://t.co/mnRF3qh17H",""
"@mclynd","How to protect your #backups from #ransomware https://t.co/9SbLLDACfH\n\n@csoonline @MariaKorolov @AghiathChbib… https://t.co/OAMb8qlpq1","@csoonline|@MariaKorolov|@AghiathChbib"
"@clouditeg","Four Lessons all Businesses can Learn From SaaS Success\n#MachineLearning #DeepLearning #ArtificialIntelligence #AI… https://t.co/eQQhLS556l",""
"@gabsmashh","@AlyssaM_InfoSec when covid chills, let's plan a trip there!","@AlyssaM_InfoSec"
"@UK_CAGE","If there is to be any meaningful change, then the US must withdraw from Afghanistan, halt its endless wars, close G… https://t.co/br8wfBybUG",""
"@AlyssaM_InfoSec","@gabsmashh Communications - Ability to translate between tech and business speak.\n\nStrategic Thinking - Able to see… https://t.co/sBYJrdpkRx","@gabsmashh"
"@TheXXLMAN","FORRESTER ha publicado una guia para pagar un #Ransomware\n\nNo me parece nada acertado.Pagar significa no sólo ceder… https://t.co/xLk8BLuGSm",""
"@blueteamsec1","GitDorker - A Tool To Scrape Secrets From GitHub Through Usage Of A Large Repository Of Dorks… https://t.co/ZlxWTtRfio",""
"@AlyssaM_InfoSec","For the first time in more than 4 years, I find myself wishing I was in Washington DC right now. I really want to b… https://t.co/xCY2grFKx7",""
"@Dinosn","How Ryuk Ransomware operators made $34 million from one victim https://t.co/qGR5HLAceD",""
"@ArkeoToys","Mattel victime d'un piratage informatique par un ransomware Oo\nBarbie aura fait tous les métiers du monde mais pas… https://t.co/1eieEdbOfH",""
"@gabsmashh","@AlyssaM_InfoSec @theladyofgeek I love this idea.","@AlyssaM_InfoSec|@theladyofgeek"
"@ingliguori","Five key qualities that #DigitalTransformation #leaders should possess\nVia @ingliguori #leadership #Cloud… https://t.co/hishEx8SkC","@ingliguori"
"@cincyvseveryone","Love how we losing followers cause of our take on the election. “Stick to sports, CVE.”\n\nYou think we give a flying fuck?\n\nNope 😂",""
"@ptracesecurity","iOS SSL Pinning Bypass (iOS 8 - 14) https://t.co/1Kox4YJb9Z  #MobileSecurity #iOSsecurity #Infosec https://t.co/oBMB9OUqx2",""
"@Ayriath","Apparently my information got leaked in a security breach, so that's cool. Thanks Chrome. \n\nHad to reset ALL my pas… https://t.co/2qbyBqgm5K",""
"@Tanguy_lrx","Did you register to attend the session “Telco DX Success Story” at DX Inspire?\n#hclswlobp #hclswfrance #nocode… https://t.co/n2r6dkbShP",""
"@ChinguCollabs","Do you know what a 'clickjacking' is?\n\nMore important, do you know how block it in your code?\n\nLearn the anatomy of… https://t.co/Fu6jhpMDOf",""
"@secure_review","2020? The worst year in #cybersecurity history? Yeah, we have about #2020 reasons not to be surprised. #infosec… https://t.co/zrY9DvfiU4",""
"@Fabriziobustama","Three ways CISOs should be rethinking mobile security in 2021\n#CyberSecurity #mobilesecurity\n#CISOs #ITsecurity… https://t.co/lrLTFlkuuE",""
"@thewhiteh4t","#FinalRecon v1.1.0 is now available!\nhttps://t.co/XiZ2M09PJM\n\n[+] Changes :\n\n&gt; Dumps are moved to user data directo… https://t.co/eSwoqlSzYx",""
"@ptracesecurity","Patches those pesky APKs for proxy use. https://t.co/iebKKtYV1W  #Pentesting #MobileSecurity #Infosec https://t.co/IrAx3rvAv0",""
"@Fabriziobustama",".@Capcom_UK hacked in latest cyber attack on game makers\nBy @BBC https://t.co/QUlzvEaXIx\n#Cybersecurity… https://t.co/jqDY4F0SvY","@Capcom_UK|@BBC"
"@Hemaya_HAT","ملخص لأهم الأدوات التقنية المستخدمة في علم التحقيق الحنائي الرقمي.\nإعداد: سارة بن دخيل\nsarah-Cybersec (in)\n تدقيق ع… https://t.co/ZKT9v2K8Hc",""
"@matthieugarin","🎬 Regardez l'excellente intervention de G. Poupard devant la Commission des affaires étrangères, de la défense et d… https://t.co/TXkZlxlAL9",""
"@kim_crawley","Wise Old Bear comix, number one: #infosec https://t.co/Nm9HDNfWjp",""
"@TamaraMcCleary","The Top #IoT Vulnerabilities in Your Devices –– Keyfactor https://t.co/ENDyDCQ3nh #CyberSecurity https://t.co/ykOQaeWtGv",""
"@SourabhSKatoch","How We Turned 25K Printed Directories into Fully Searchable Digital Records.\n\nhttps://t.co/8b1DXbK1fd\n\n#Python… https://t.co/RPYXuEBETE",""
"@Hacker0x01","Last call! If you are a retired veteran or active duty military looking to grow your career in cybersecurity, check… https://t.co/Ts2i4gXP2T",""
"@H3KTlC","Spending the weekend refreshing for the sec + exam and finally taking it next week. There needs to be zero room for… https://t.co/0sll5bASWV",""
"@digitalcloudgal","📌 Q: What is not one of the SDLC phases?\n\nA: Reject\n\nv/ CCSP study guide\n\nCc: @Clarify360 \n\n#cloud #cybersecurity… https://t.co/IwJ2FN8VjW","@Clarify360"
"@Bank_Security","A Threat Actor is selling a list of IPs allegedly vulnerable to the #Fortinet bug CVE-2018-13379.\n\nAmong the victim… https://t.co/iatCsTlonl",""
"@ChristopherSix","I’d say now is better then anytime for the old joke. “Two old guys walk into a bar.....” yeah. Lame but true.… https://t.co/EQQYqExaRe",""
"@j_opdenakker","Use a password manager. Preferably not a browser built-in one but that’s still a lot better than not using a passwo… https://t.co/5pBp7jw36K",""
"@ncweaver","@colbynotacheese @davidgerard Option A:  The massive ecological waste of something burning the power of a medium si… https://t.co/juWfcKbWhB","@colbynotacheese|@davidgerard"
"@ptracesecurity","Metasploit Cheat Sheet  https://t.co/uxLFx0SAvp  #CheatSheet #Metasploit #CyberSecurity #Infosec https://t.co/r4e2xdMbN0",""
"@three_cube","OSINT: Abusing DNS for Reconnaissance #recon #dns #cybersecurity #cyberwarrior \n\nhttps://t.co/s0CdExuWT4 https://t.co/2Qnz5JglgV",""
"@DigitalBlkHippy","Everyone can learn to code but only some people will want to code for a living. And that’s coo too!\n\nMake money doi… https://t.co/xpAl94bNdU",""
"@theblue_hearts7","@watanabeatushi これ本当なら凄いですよね。トランプさんは6月ツイートで、外国から大量の郵便投票がくると言ってましたし、米国DHSも2020年迄に各州に裏付けとれる郵便投票の仕組みを入れたいという下記記事ありますし。… https://t.co/oMndg6qjFH","@watanabeatushi"
"@AlyssaM_InfoSec","Alright @BsidesORL, I'm ready to talk cyber security career building, are you?? Let's do this. https://t.co/6cpGHPyaL9","@BsidesORL"
"@HarbRimah","5 Must-Have Data Science Skills That You Should Learn.\n\nhttps://t.co/1HMaphSCj7…\n\n#MachineLearning #DataScience… https://t.co/HqmskGdNW1",""
"@hackerb0t","Infosec isn't just a profession, it's a lifestyle",""
"@three_cube","Open Source Intelligence (OSINT) Zmap for Scanning the Internet: Scan the Entire Internet in 45 Minutes! #zmap… https://t.co/ZCingIf5vL",""
"@CioAmaro","Hackers attacking your memories: science fiction or future threat? | ThreatRavens \n#Infographic [ @CioAmaro ]… https://t.co/vNN9FTvXVm","@CioAmaro"
"@Cougwill","We have seen @NickRolovich @SteveGleason @theanthonymic and others #WaveTheFlag in 2020. I wonder who the… https://t.co/2cUEZCBiC3","@NickRolovich|@SteveGleason|@theanthonymic"
"@blueteamsec1","Oregami - IDA Plugins And Scripts For Analyzing Register Usage Frame https://t.co/SUbjg9AxOm #hacktool #kitploit… https://t.co/7PyqgxFlfq",""
"@maldevel","Intercepting HTTPS on Android #pentest #infosec \nhttps://t.co/tX1AdICXy7",""
"@matthieugarin","Wahou... une victime a déjà payé 2200 $BTC lors d'une attaque #Ryuk 💵: ça fait $34M !! 🤕 #Ransomware… https://t.co/bNxd1MWNYd",""
"@780thC","Russian-speaking threat actor made $34 million from one victim https://t.co/rfJgxiU83N",""
"@nekomesi77","国土安全保障省(DHS)のサイバーセキュリティ機関は木曜日、選挙当局や民間セクターグループと提携して、2020年の投票の正確性を確保するために使用できる選挙監査ツールを開発すると発表した。 https://t.co/MXsuCiivdz",""
"@crystal78243104","DHS cyber agency invests in election auditing tool to secure 2020 elections | TheHill https://t.co/ngP0ZezjeU",""
"@NikolovScience","BREAKING: Russel Ramsland, founder of the Dallas Cybersecurity Firm ""Allied Security Operations Group"" reveals TECH… https://t.co/I9UXnOy8VP",""
"@rnbwkat","In less than 2 hours I will be giving my newly updated ""IoT Honeypots"" talk @BsidesORL Why not join the fun? #IoT… https://t.co/qOCkeOGxcv","@BsidesORL"
"@WSU_Noel_Schulz","Good luck to @NickRolovich &amp; @WSUCougarFB 🏈 today as they start their season. Thank you to #Cougfamily for rooting… https://t.co/c64Gdhg2Sm","@NickRolovich|@WSUCougarFB"
"@Bank_Security","A Threat Actor is selling a data dump from a company that develops software for Banks.\nThe TA also claim to have th… https://t.co/9f0VxPazPs",""
"@DrJDrooghaag","🔵 Book of the Month!\n\nCybersecurity Threats, Malware Trends, and Strategies by Tim Rains\n\nGet your copy here 👉… https://t.co/7yJ1F61ZEN",""
"@turing_research","Digital Hygiene? \n\nWhat is Digital Hygiene and why is it so important to maintain?\n\nIn our latest feature our team… https://t.co/fFBWmeeLEd",""
"@hackinarticles","Burpsuite for Pentester – Fuzzing with Intruder (Part 2)\n\nhttps://t.co/FaraF73nD5\n\n#bugbounty #infosec #hacking https://t.co/bZFk5Bf6kl",""
"@iambriancarroll","""When it comes to those who threaten our democratic processes, we are equal opportunity disruptors. We're going to… https://t.co/eTjyNqiYhb",""
"@ZDNet","Linux version of RansomEXX ransomware discovered https://t.co/PyImu76Gqr",""
"@enricomolinari","Mystery Plane Spotted Flying Over California, US Air Force Won’t Comment https://t.co/FRYTGdrB3X @IntEngineering vi… https://t.co/sKaIQZKFv0","@IntEngineering"
"@BSidesCL","Tremenda producción para y por la comunidad #CyberSec de Latam, desde @BSidesCL los invitamos a seguirnos en… https://t.co/ztmoJahJxO","@BSidesCL"
"@BMBF_Bund","Mit der Veranstaltungsreihe „Women in Cybersecurity“ gibt @ATHENECenter Frauen in #Cybersicherheit eine Plattform,… https://t.co/EOg7qW1c6r","@ATHENECenter"
"@aybubiltek","Temel Ağ Bilgisi eğitimimizi Cemal TANER’in (@taner_cemal) anlatımıyla YouTube(@ybubiltek)üzerinden canlı olarak ge… https://t.co/SbvEN8IXkR","@taner_cemal|@ybubiltek"
"@hackerscrolls","Have you ever wonder about fast and easy-to-use SOCKS proxy over DNS?\n\nHere it is\nhttps://t.co/2eVTTRvbtw from… https://t.co/MxYNhWm12Z",""
"@Hakin9","XSSMAP - Detect XSS vulnerability in Web Applications https://t.co/9H6xlMPQC2 \n\n#infosec #hacking #hackers… https://t.co/TuYT3oDVAX",""
"@1ZRR4H","Guía para pagar un rescate de #Ransomware según Forrester. \n\nEspero nunca llegues a esto 🥴\n \n######################… https://t.co/qmwuOGLOTb",""
"@0xConda","If anyone has taught you something new, pay it forward.\n\nTeach others and make #infosec awesome.",""
"@AlyssaM_InfoSec","@theladyofgeek Yes but can we replace the term soft skills with core skills? Core skills being those skills, like w… https://t.co/2NLPNLjyRe","@theladyofgeek"
"@cyberpeacecorps","Social media Platforms fined for 1.1 million USD by the Turkish Government. Find out recent #cybersecurity #news in… https://t.co/3xKZ8f7GPP",""
"@RickHan","@KMCRadio Kevin,  in cyber security design flaws are used by attackers. These vulnerabilities are documented, it on… https://t.co/D6OkMJ0UPz","@KMCRadio"
"@chidambara09","#Crypto.com Becomes the 1st #Cryptocurrency Company ,,, \n\nhttps://t.co/44rsF1SLQx\n\n#bigdata \n#AI #IoT #Tech #IT… https://t.co/bQzeSk36dK",""
"@forsyo","Takde sebut tentang JASA pun?\n\nCENDANA dan Cybersecurity yang dapat peruntukan lebih kecil sebut pula.\n\nNak tunggu… https://t.co/gPhBRqcbqZ",""
"@CiscoSecure","To better understand the #cybersecurity challenges organizations faced with the sudden transition to #remotework, C… https://t.co/4bJ7eh6X4V",""
"@muhabbitcom","Capcom Ransomware Kurbanı Oldu! Saldırganlar Kripto İstiyor! https://t.co/zpRzRlj4G7",""
"@tht_en","Artificial Intelligence and Motion Sensors Make Holographic Avatars Dance!\n\n#artificialintelligence #security… https://t.co/yysJon4fyw",""
"@mari_318wanko","DHSチーフは、2020年の選挙までに、50州すべての当局者に「検証可能な」投票を行うよう呼びかけています。\n\n「すべての州および地方の選挙当局は、2020年の大統領選挙までにすべてのアメリカ人が投票することを確認してほしいと述べ… https://t.co/2idFT0TvoP",""
"@ingliguori","8 #disruptive life sciences technologies deliver innovative value @KPMG \nVia @ingliguori #DigitalTransformation… https://t.co/d4Xe2Pz4uw","@KPMG|@ingliguori"
"@PH_1ns1dr","Our correspondent also received reports that the SOG cybergroup is creating dummy accounts and interracts with pro-… https://t.co/FvQIoDF5ZO",""
"@_whitneywebb","@caitoz Don't worry, they plan to find some Iranian meddlers in the next 45 days. DHS said the election was ""halfti… https://t.co/SF8v9m3EwX","@caitoz"
"@BSidesDFW","#BSIdesDFW2020 Activities\nPoint3 Security CTF:  https://t.co/v1dKoqIRu5\nPrevade Cybersecurity CTF:… https://t.co/nUf3woMYF5",""
"@CyberSecOb","RansomWhere? Everywhere\nhttps://t.co/8VrBPhaZAh\n@sepiosys\nThis article is part of the Cybersecurity Observatory US… https://t.co/sZacfS37kp","@sepiosys"
"@VotesWhy2020","@jennycohn1 @DrPaulGosar @dougducey @Leo4AzHouse @FannKfann The Democrats tried to pass election reform that requir… https://t.co/sotpfGfvaT","@jennycohn1|@DrPaulGosar|@dougducey|@Leo4AzHouse|@FannKfann"
"@TheOfficialSBI","SBI customers are requested to be alert on Social Media and not fall for any misleading and fake messages.\n\n#SBI… https://t.co/G49ivmTs2b",""
"@IanLJones98","Why Is Privacy the new dilemma of 2020? By Jaime Manteiga v/@Forbes #AI #ML #CyberSecurity #Privacy cc… https://t.co/bK25s35zKg","@Forbes"
"@CCSIT_KFU","#CCSIT established the #Cybersecurity Club in line with the Saudi Arabian #Vision2030; the Kingdom's Strategic Plan… https://t.co/AGRBgdd9w5",""
"@as_informatico","Intentando entender qué y cómo, todo sea para ayudar... #LockBit #Ransomware https://t.co/ih1FHnbhp1",""
"@AnnoDomaini","https://t.co/eyuy9Qucia \nCreate your own #brand or increase online visibility. \n\n#Api #APIs #APIs4B #Api4B… https://t.co/fHd7Xx030y",""
"@pbcsd","We're preparing students for careers in high demand! 💻 Check out the cybersecurity course offerings at… https://t.co/qPXC866PfK",""
"@THT_Resmi","Clickjacking Saldırısı❗️\n\n#cybersecurity #cyberattack #cyber #security #data #attack #attacker #system #veri… https://t.co/MdYtisjbIQ",""
"@hackernoon","""Is a ZeroTime/Zero-Trust Approach the Perfect Cybersecurity Model?"" https://t.co/5kxTzUHZvU #iot #cybersecurity",""
"@aaaamhim","$ITOX an unknown #startup with $1 potential at 1 cent?💸📈✈ https://t.co/nmWlu1Q0zK\n#IoT #IIoT #RStats #JavaScript… https://t.co/3Q9KGRTILC",""
"@aaaamhim","$ITOX #startup with $1+ potential at 1 cent https://t.co/nmWlu1Q0zK #iiot #MachineLearning #DataScience #BigData… https://t.co/HJRm5sMHAF",""
"@TamaraMcCleary","Enterprise Internet of Things (#IoT) #cybersecurity https://t.co/2V2dliBpy9 https://t.co/CaOqNtctEP",""
"@danjconn","Secluded lab ftw!! Hoping my CFP for @grimmcyber 0x3 gets accepted to show some goodies!\n\n#raspberrypi… https://t.co/mqO6vPc5Yn","@grimmcyber"
"@wired_jp","全米で新型コロナウイルスの感染者数が急増しているなか、この数週間で米国の約20の病院と医療機関に新たなランサムウェア攻撃が押し寄せた。https://t.co/lxUaIOa6yV",""
"@RalGhanmi","ثلاث لغات برمجية مهمة وانصح في تعلمها للي حاب يدخل مجال #الامن_السيبراني #التشفير #الذكاء_الاصطناعي وعلوم #البيانات… https://t.co/DGI7cxGp0c",""
"@codepo8","Well, that's a new form of ransomware.\n\nGoogle has quietly released an app in the Play Store, Device Lock Controlle… https://t.co/bcHPwBwMaY",""
"@CyberWarship","Sysmon Internals - From File Delete Event to Kernel Code Execution\n\n#infosec #pentest #redteam… https://t.co/lK7ccRcwVf",""
"@desirevile","sensibly human V/@farhad55526050 cc:#TOI #gamedev #indiedev #socialmedia #cybersecurity #Manali @Nicochan33 @DrRwtl… https://t.co/hARMRfv5gp","@farhad55526050|@Nicochan33|@DrRwtl"
"@R_Demidchuk","From conceptualization to support: this #Infographic shows the building blocks of #IoT\n\n#DigitalTransformation… https://t.co/DblkixyqlN",""
"@akajunoon","Many people shared this to bypass some restricted areas but i don't when and where it will work for me :(… https://t.co/xheBaWJvR1",""
"@GDGJalandhar","Cyber Security is a topic of concern.\nBhasker and Ashwani are going to dive deep into cybersecurity at… https://t.co/Ey6gP6xVT3",""
"@PwnL0rd","Written a blog on url connections in java and some details on lfi,ssrf and leaking java version through file protoc… https://t.co/ved9ZVYCdz",""
"@pcgamer","Capcom's been hit with a ransomeware attack https://t.co/bcHOvvfFfr https://t.co/BrDzwxOt7q",""
"@DerechodelaRed","El sistema judicial de Brasil bajo un ciberataque de ransomware RansomExx.\n\nhttps://t.co/4cGU7ANXSS",""
"@Mah3Sec_","A short list of endpoints (From Unknown Resource but thanks to that guy for sharing this with me)\n#bugbounty… https://t.co/LvZEJwCrRP",""
