"screen_name","content","mentions"
"@philipbstark","#Georgia really struggles with basic #election #cybersecurity. Why last minute uploads? ""Glitch"" makes this sound l… https://t.co/HbJ9H8PFLI",""
"@Sydfish","Resisters... Please meet a good friend of mine. \n\nHe is resisting hard from Portland OR, just quit FB a few months… https://t.co/UFHNLxYw1H",""
"@reach2ratan","Rising Ransomware Breaches Underscore Cybersecurity Failures https://t.co/s9HIWRUBgI\n\n#CyberSecurity #digital… https://t.co/OcoQlI7jEr",""
"@notthassan","@yaqeeninstitute went awfully quiet and turned their replies off when their links to CVE and hypocrisy was exposed… https://t.co/QnvV1fpObs","@yaqeeninstitute"
"@PolitiikkaTV","@OulunN https://t.co/YzmFbfAdgH","@OulunN"
"@correio","Ransomware: entenda como funciona o vírus que invadiu os sistemas do GDF\n\nNesta quinta, Sistema de informática do G… https://t.co/E1r0fMmsz2",""
"@Infosec_Taylor","It's pretty damn sad when the news has to cut away from your speech because you are lying. It's 1000x worse when you're the president.",""
"@exame","“Elo mais fraco é o ser humano”, diz especialista em segurança cibernética https://t.co/fG84s0XsPG",""
"@reach2ratan","Emotet operators are running Halloween-themed campaigns https://t.co/wK4ZIwVZQM\n\n#CyberSecurity #digital #Hackers… https://t.co/Sur4QbuKp9",""
"@Cesare87254983","Conhecendo de perto o ransomware,    o malware que supostamente atacou os sistemas do STJ. https://t.co/xk5Foqggpv",""
"@Codifyd","Cloud computing has been a key enabler in this digital transformation - https://t.co/qtiZwLmZOp… https://t.co/22t4INPZVK",""
"@BleepinComputer","Campari hit by Ragnar Locker Ransomware, $15 million demanded - @LawrenceAbrams\nhttps://t.co/YoXMAdgHQr","@LawrenceAbrams"
"@UTSA","Researchers at @EngineeringUTSA and U of Oklahoma can decipher what you type during video calls with up to 93% accu… https://t.co/YGiRNYc4Vz","@EngineeringUTSA"
"@DetailsSkewed","@RealJamesWoods Well they banned him, I give it a 60%/40% split. \nhttps://t.co/Bs2I8hZf9t","@RealJamesWoods"
"@OldCraig","🤔2018: https://t.co/hpKjMyHW7U",""
"@womenknowcyber","These #Women Know #Cybersecurity.. InfoSec Manager @zakiyaalaamri82 | Software Engineer @ChaimaBellout | Cybersecur… https://t.co/0R0eq7GSd5","@zakiyaalaamri82|@ChaimaBellout"
"@pepesgrandma","2019 : Pennsylvania, Michigan, Virginia, Ohio and Georgia signed on to partner with CISA on Arlo.  Others may have… https://t.co/LId2i6F3wW",""
"@campuscodi","Brave fixes bug that accidentally logged some Tor session data\n\nhttps://t.co/JFMN5SSOSi https://t.co/gAINz2crQW",""
"@brysonbort","@ian_infosec It has been 0 days since STUXNET was mentioned.","@ian_infosec"
"@_whitneywebb","The ""election security operations center"" run by DHS, US intelligence, the military and Silicon Valley (including s… https://t.co/bV8c5w2nuV",""
"@FalseSenseOfSec","NASA's Electric X-Plane's Propellers Undergo Wind Tunnel Testing #Visualization #hacking #AI #cybersecurity #cloud… https://t.co/6ZbLn8FknB",""
"@GizmodoBR","O Superior Tribunal de Justiça e mais órgãos públicos estão com servidores fora do ar. O motivo seria um ataque de… https://t.co/sc2XEOWRQB",""
"@CompTIA","Tune in now and join us as cybersecurity expert, Juan Fernandez talks about his role in identifying and solving an… https://t.co/c9lK9THc6d",""
"@UK_Daniel_Card","It might seem like a small % but it's the details that I've found get people pwn3d. and trust me... you don't want… https://t.co/sXw4DydGEH",""
"@KnowUrEnemy3","🔥🔥🔥PATRIOTS, TAKE NOTE🚨💥🔥🚨💥🔥🚨💥🔥👇👇\n\nDHS cyber agency invests in election auditing tool to secure 2020 elections https://t.co/9HBixTqqfp",""
"@C4i7Z","@bbusa617 https://t.co/D5yS9mW2kx","@bbusa617"
"@0fjrm0","El FBI alerta sobre una inminente amenaza de ataques de ransomware al sistema de salud de EEUU https://t.co/iQ8aLVLhLa",""
"@Alonso_ReYDeS","He publicado las diapositivas utilizadas en el Webinar Gratuito: ""Buscar Archivos Digitales para OSINT"". Luego publ… https://t.co/hBqjGK6ZAz",""
"@_DWRobinson","@tracybeanz @drawandstrike He mentioned this. Why would Twitter be so concerned?\nhttps://t.co/6UvxAhvwEb","@tracybeanz|@drawandstrike"
"@billatnapier","Three new @EdinburghNapier Cybersecurity lectureships coming up and research posts ... and lots of PhD positions...… https://t.co/upMuz6fzXv","@EdinburghNapier"
"@bad_packets","Mass scanning activity detected from 154.49.211.105 (🇫🇷) checking for F5 BIG-IP servers vulnerable to CVE-2020-5902… https://t.co/9m9PwEpeEi",""
"@9NEWSNANCY","DHS cyber agency invests in election auditing tool to secure 2020 elections.\nOops 🙊 \nhttps://t.co/JJnXYCZ6fb",""
"@jesuisexterieur","@AmyCollingswor1 @RealJamesWoods https://t.co/AvVcqeUDbK","@AmyCollingswor1|@RealJamesWoods"
"@minjaoo","Zdravko mogao si ovim ministrima ranije malo najaviti kandidature čisto da se pripreme, prebrišu društvene mreže, p… https://t.co/KxcJtD6DYQ",""
"@Tecnoblog","STJ é vítima de ransomware que atacou várias empresas nos EUA https://t.co/3Ten9ivKh6",""
"@aramosorg","2/ Aparentemente foi uma infecção por malware (malicious software, nome mais técnico pro popular ""vírus""). O tipo e… https://t.co/TiP7l9dEBD",""
"@jesuisexterieur","@RealJamesWoods https://t.co/AvVcqeUDbK","@RealJamesWoods"
"@CodingShortcut","I’m applying for the #informationsecurity position, here is a copy of my resume #encoded , #encrypted &amp; shredded… https://t.co/Amxe9gkulH",""
"@Infosec_Taylor","Them: Can you approve the installation of this equipment?\n\nMe: Approved as long as it goes on this specific network… https://t.co/x35eTMj9ON",""
"@alexpupich","@RealJamesWoods https://t.co/4o7jiwnFkt","@RealJamesWoods"
"@RavivTamir","ZLoader, the infamous banking trojan, is making a comeback as part of active ransomware campaigns. See the new Thre… https://t.co/nwg4FXUDGf",""
"@blueteamsec1","Manuka is an Open-source intelligence (OSINT) honeypot that monitors reconnaissance attempts by threat actors and g… https://t.co/z5jd0gG0kW",""
"@arpitrage","Cryptocurrency has enabled a wave of hacking. UCSF, for instance, paid out $1.14m to hackers (… https://t.co/7bUsTJIiQW",""
"@reach2ratan","Chrome will soon have its own dedicated certificate root store https://t.co/Ik1jFUcnzP\n\n#CyberSecurity #digital… https://t.co/m2KpUXiDHi",""
"@jp_koning","Average ransomware payment just hit $233,000 (~20 bitcoins): https://t.co/PbXRtiWpKl\n\n-50% of ransomware cases incl… https://t.co/KKqcuOCEQR",""
"@Hakin9","Installing Kali on Raspberry Pi - it's another video tutorial available on our blog. Check it out &gt;&gt;… https://t.co/47jVdAaNDG",""
"@CHHR01","I agree... when you consider the tool they put in place, \n\nEyes on the Auditing Tool... currently being used by the… https://t.co/NlSReRs51k",""
"@graylog2","Announcing the Graylog v4.0 Beta! 🥁🥁\n\nWe know you'll love these awesome new features:\n✅  Permissions management\n✅… https://t.co/eRmDYujlut",""
"@LaPapaEsPop","os caras rodaram um ransomware no STJ inteiro e vocês ai acreditando que as urnas são invioláveis, que as eleições… https://t.co/yqtJJFHD5c",""
"@aicanedo","How to do #DataVisualization in #Python for #DataScience\nhttps://t.co/ByXShhIEuS #MachineLearning #Python #AI… https://t.co/GupO6xFKtC",""
"@pokeprotos","I wonder how Capcom will handle this.\n\nhttps://t.co/hqTZ5eifN7",""
"@NaureenCFink","Kiitos @Sisaministerio @SuomenPoliisi @MariaOhisalo @PKairamo @FinlandUN for briefing the #UNSC Counter-Terrorism C… https://t.co/dpVUXEp3Wy","@Sisaministerio|@SuomenPoliisi|@MariaOhisalo|@PKairamo|@FinlandUN"
"@ninaandtito","Russia and the US were fighting over who would get to extradite Vinnik from Greece, where he was arrested. Then Fra… https://t.co/u6gmwJvphT",""
"@LenzViktor","Mano, o STJ sofreu um ataque de ransomware",""
"@gtcarlos_","Sério mesmo que rolou um ransomware no STJ? 😂\n\nhttps://t.co/G7RMmllC1U",""
"@eventhubs","Capcom hacked by third party, full terabyte of data allegedly stolen https://t.co/aFiiqn9CqR",""
"@Andreizilla","Ransomware em arquivo físico? WTF. https://t.co/2L81DdWOaH",""
"@reach2ratan","Companies paid $4.2M bug bounties for XSS flaws in 2020 https://t.co/WmHK8wNaw1\n\n#CyberSecurity #digital #Hackers… https://t.co/sbJVQ86eAB",""
"@ipfconline1","Gartner: Top strategic technology trends for 2021 \n\nhttps://t.co/BsfQlVLQxb by @Mcooney59 v/ @networkworld \n#AI… https://t.co/cYpAxgSwG5","@Mcooney59|@networkworld"
"@tianhuil","Top #Python Libraries for #DataScience, #DataVisualization &amp; #MachineLearning. via @kdnuggets… https://t.co/GLuHnvJWz0","@kdnuggets"
"@AlyssaM_InfoSec","Well dammit if that doesn't just sum it up perfectly! https://t.co/xbBaIpdVK6",""
"@jschauma","""Zero Trust"" is still something that's misunderstood even by folks in the #infosec space. So here's a quick thread… https://t.co/tFDg0s6ktC",""
"@Queercon","So proud to have made this list!  Glad to see so much work in Diversity in Infosec! https://t.co/txdA1zcjoW",""
"@dfaranha","@gustavokov Ransomware no papel! Bem que dizem que digital é mais seguro que papel, agora fez sentido.","@gustavokov"
"@RAUL_PUCELA","Abro hilo) Totalmente apoyo a la hostelería, pero quiero ser políticamente incorrecto hacia una pieza ""importante""… https://t.co/ZPF4bLGZFq",""
"@sa_libertaria","Falhou o link to postando aqui \n\nhttps://t.co/hKtVElYmFo",""
"@BleepinComputer","Brazil's court system under massive RansomExx ransomware attack - @serghei\nhttps://t.co/YlEJomOKnh","@serghei"
"@cibercrimen","Los creadores del ransomware Maze avisan que cierran sus operaciones, afirma su comunicado de prensa (Inglés)… https://t.co/5ER640smOD",""
"@LisaForteUK","Okay I have to confess something. There is a certain person in infosec who has been setting up sock accounts to bul… https://t.co/qmentZFtm3",""
"@RCMPAlberta","Thinking about starting your holiday shopping? Don’t purchase anything while using public Wi-Fi. Shop on a Wi-Fi ne… https://t.co/FwmB3wzNjP",""
"@NCSC","In this week's Threat Report: US advisory on ransomware targeting of US health sector https://t.co/W8aZM41nI7 https://t.co/B7tA3K023g",""
"@vxunderground","The Brazilian government got hit with ransomware. 8 entities compromised. Why is this not all over tech Twitter right now?",""
"@cvebase","Explore the latest #Jaeles CVE detection signatures: https://t.co/WdargUkHj5 https://t.co/z7xtGilKSv",""
"@HackRead","🚨 The high severity privilege escalation #vulnerability affected Windows Server and #Windows10.\n\nMore:… https://t.co/h73ObSw4Ry",""
"@ligiaelenagv","DHS chief calls on officials in all 50 states to have 'verifiable' ballots by 2020 election | TheHill https://t.co/mckAylLDl4",""
"@CVEnew","CVE-2020-25661 A Red Hat only CVE-2020-12351 regression issue was found in the way the Linux kernel's Bluetooth imp… https://t.co/VvVYrlyBTI",""
"@CampinaSalomao","STJ - SEQUETRADO\n\nA mensagem é vaga, mas dá todos os indicativos de que se trata de um ransomware, quando hackers s… https://t.co/CeQtn9adRD",""
"@demartinifelipe","Aqui meu texto em português sobre o assunto da Capcom https://t.co/dSkZ2C0UKB",""
"@BillMew","Continuing their discussion in honour of the late great #SeanConneryRIP, @DrJDrooghaag and @BillMew reveal who'd ma… https://t.co/jWbis6RGGK","@DrJDrooghaag|@BillMew"
"@IvoEmanuilov","Thanks a lot for the feedback! More interdisciplinary research is needed on how to approach computer design for bet… https://t.co/B0iMktC9WN",""
"@BillMew","In honour of the late great #SeanConneryRIP, @DrJDrooghaag and @BillMew discuss who they think would make the best… https://t.co/J4Qv4wxM0c","@DrJDrooghaag|@BillMew"
"@cristian_cve","@biobio Llego la dignidad ?","@biobio"
"@Tec_Mundo","Até mesmo os backups dos sistemas da Corte foram sequestrados; saiba mais! #tecmundo https://t.co/TUh8XuEviu",""
"@Hakin9","PhoneInfoga - Advanced information gathering &amp; OSINT framework for phone numbers https://t.co/WpIEslOkpn \n\n#infosec… https://t.co/jwLMbjLWDl",""
"@0xMohamedhassan","الدروس المستفادة:\n1. لا يمكنك تأمين شيء ما دون معرفة كيفية عمله\n2. فهم ال System administration و الSoftware Engine… https://t.co/tmga1zQIC6",""
"@felipepayao","Pingou resposta: hacker respondeu email de contato para pagamento do ransomware. Por enquanto, sem novidades https://t.co/sqf86KD7fW",""
"@Kyo_DMC","What the actual Hell is this\n\nHope that Capcom will be able to recover (from) this. Damn it.\n\nhttps://t.co/OXcyYTCLlD",""
"@UAFG_AR","Man, SE PUDRIO TODO! https://t.co/zuk4CFaL9Y",""
"@canaltech","Capcom é atingida por suposto ataque de ransomware https://t.co/j32EtX25uQ",""
"@NolaNurseRN","🤔https://t.co/2mCYQRTPD4",""
"@KevinClarity","“Artificial Intelligence Is The Key To Crack The Mysteries Of The Universe, Here’s Why!” by Bharath K… https://t.co/ED6SB7Ersj",""
"@CESIN_France","Ransomware, Covid-19, espionnage, terrorisme… L'Anssi fait un état des lieux de la cybersécurité \n https://t.co/91ZDp4sFxe",""
"@InfoSecComm","New Write-up on InfoSec Write-ups publication : ""How to start Bug Bounty?"" #bugbounty #bugbountywriteup… https://t.co/tSBQF7fw5L",""
"@blueteamsec1","Pwndoc - Pentest Report Generator https://t.co/0SmEMjBEHV #hacktool #kitploit #infosec https://t.co/FZOceRa24H",""
"@AndreaDraghetti","Italian beverage vendor Campari knocked offline after #ransomware attack by ⁦@campuscodi⁩! \n\n#mwitaly #malware  https://t.co/TJXe41oqja","@campuscodi"
"@MrCl0wnLab","Todo fucking ano rola ataques em massa, e os infosec gov ainda não criaram protocolo de monitoramento pra tal dia..… https://t.co/ZXTyS6ta1b",""
"@0xggus","23:59 - ""A urna eletrônica brasileira é segura e rápida, americanos contando papelzinho, haha"".\n*Ransomware no STJ*… https://t.co/N4dyVQaQYc",""
"@TheHackersNews","Uncovered — North Korean hackers implanted a previously undiscovered #spyware, dubbed 'Torisma,' on the victims' sy… https://t.co/hGhTbUCwbe",""
"@Muirey03","CVE-2020-9974 if anyone wants to see if they can spot it themselves (I'll release the details soon): https://t.co/cqf6Fu9ILf",""
"@SteveSyfuhs","Worth a read: Attacks exploiting Netlogon vulnerability (CVE-2020-1472) https://t.co/L9FXoYqxuV",""
"@jennypotts","The comments on here are ace (they're by my InfoSec BSc class-mates) 😂😂😂\n\nWho can spot @jamieshighfield? https://t.co/2cwszHLsL0","@jamieshighfield"
"@driwaldorf","The second most important court (https://t.co/gghQSs0pYw) in Brazil was hacked. The ransomware affected judge’s ema… https://t.co/JBUHK3fNQh",""
"@IIoT_World","In order to overcome #cybersecurity risks in #smartfactories, certain security issues need to be addressed. Keep yo… https://t.co/3AQppfmuQj",""
"@hackinarticles","Burp Suite for Pentester – Fuzzing via Intruder Tab\n\nhttps://t.co/4ds5EqJdP1\n\n@PortSwigger #burpsuite #infosec… https://t.co/rj8fuED0F1","@PortSwigger"
"@leonardovilelaa","(1) Sobre o ""hacker do STJ"", algumas questões técnicas. Segue o fio:\nPelas notícias até agora, tudo indica ser um a… https://t.co/wtDNBPNCWy",""
"@linqtoinc","""We are #uber-izing cloud storage. We are changing how #humanity can make money."" - @saswata_0chain  of… https://t.co/2uoz9T2gRQ","@saswata_0chain"
"@GossiTheDog","Here's an great example of Bazarloader/KEGTAP to Ryuk ransomware in two hours in real world, using things detected… https://t.co/m56UpSgr2J",""
"@quenteeletrista","assuntos relevantes do momento:\n- amapá em estado de calamidade sem energia\n- sistemas do governo federal e DF alvo… https://t.co/Ew6UTg3Ni2",""
"@three_cube","Python Scripting for Hackers, Part 1: Getting Started #python #python4hackers #cyberwarrior #cybersecurity… https://t.co/tqlWuVwO20",""
"@alotof_josh","Imagina você fazer parte de uma das estruturas de estado mais poderosas do país e perder tudo que você tem pra um a… https://t.co/6AlyrGIM8Y",""
"@bobrasX","CoinField's website is under massive DDOS attacks. Our cybersecurity team is currently working on that. \n\nThe websi… https://t.co/EEqJMKrOtx",""
"@BsidesORL","We need a eBay security contact ASAP. Please retweet for reach. DM if you can help. We will likely cancel the Silen… https://t.co/l4YsAysv6J",""
"@500Startups","Join us Dec. 1st for ""Cybersecurity for Startup Growth and Sales"" in partnership with CDW Corporation. Experts will… https://t.co/TIflpXVJt0",""
"@iOSNJB","CVE-2020-10016 de Alex Helie\n es la vulnerabilidad más interesante corregida en iOS 14.2 #Jailbreak https://t.co/sgdHwZTj0H",""
"@campuscodi","Here's a copy of the ransom note. RagnarLocker again, as the Capcom incident from earlier today… https://t.co/fd6uCsupoD",""
"@hackermaderas","Github ""Awesome"" Resource Repos 1/2\n\nDecentralized Web\nhttps://t.co/9OAiwI3xJC\n\nHacking (Links to many other OffSec… https://t.co/Uy44H2rwgI",""
"@unfoldmybrain","Interesting idea. What do you think, #infosec tweeterers? https://t.co/Ds6yZM4p34",""
"@_mbanana","Random ?\n\nFor an InfoSec job interview, do you support the idea of presenting the interviewee with a question about… https://t.co/dqdPZqm2dj",""
"@gfelitti","num ano de histórias inacreditáveis, essa tá no top5.\n\ncomo o Governo Federal não tem uma estrategia de infosec, um… https://t.co/CPmygBAK9F",""
"@mclynd","How network #segmentation mitigates unauthorized access risk &amp; East to West movement by #hackers… https://t.co/gohidUh4l5",""
"@TarjaMankkinen","Today good dialogue Finnish #CT #CVE measures with the #UN CTC #UN_CTED. UN report is available… https://t.co/gIphW6rw9G",""
"@RealSlimKag","Be careful before saying we’re conspiracy theorist. This is from last year \n\n🌾👀🌾\n\nhttps://t.co/xvsPty7dD1 https://t.co/58zQ6oXgjR",""
"@NDPRAcademy_","Data Protection Tip!\nDo not use the same password across your accounts\n\nVisit https://t.co/ouccwRcrB4 or listen to… https://t.co/TXQMPs3iZo",""
"@demonslay335","#Ransomware Hunt: calls itself ""Tripoli"" and uses the most generic-ass extension "".crypted""...\nNote ""HOW_FIX_FILES.… https://t.co/m3kAigIdLI",""
"@andrenit","@RafaelHGondim @marcogomes É improvável, pois os arquivos são assinados digitalmente (em muitos casos pelas partes)… https://t.co/wxjKZJ09Wl","@RafaelHGondim|@marcogomes"
"@alexstamos","It was nice to write a classic infosec tweet with no connection to electoral politics.",""
"@benhawkes","Apple have fixed three issues reported by Project Zero that were being actively exploited in the wild. CVE-2020-279… https://t.co/vdOaFXiXKs",""
"@brfreed","I have never felt more personally targeted by ransomware. https://t.co/YMp4S5rF7e",""
"@jorgeorchilles","New post about #Ryuk by @TheDFIRReport stating 2 hours from initial access to objective: https://t.co/zehXuso0gE\n\nO… https://t.co/pkuwgU4McX","@TheDFIRReport"
"@IgnitePsc","License to Hack! Tech students use real hacking tools to attack a vulnerable website on our Linux server. ""Think Li… https://t.co/6v9DCozIMJ",""
"@LixaH_CL","Capcom fue victima de Ragnar Loker Ransomware. 🧐 https://t.co/HnnPSZ5x7w",""
"@katsund4","💥💥💥👇👇👇💥💥💥\n\nDHS cyber agency invests in election auditing tool to secure 2020 elections\n\n@prayingmedic\n@X22Report… https://t.co/zBAtr44AFs","@prayingmedic|@X22Report"
"@exame","Mastercard lança solução de AI para proteção contra ataques cibernéticos https://t.co/hKhX10AScY",""
"@ipfconline1","2021 Trends in #CloudComputing: The Omni Present Multi-Cloud Phenomenon\n\nhttps://t.co/pLRwIEKQ7v v/ @insideBigData… https://t.co/a4MhmRQH4m","@insideBigData"
"@Hakin9","Portable Hacking Setup - Preview https://t.co/wcpMhJzQlz \n\n#infosec #hacking #hackers #Pentesting #programming… https://t.co/MMoSYm5VuS",""
"@sarah_fong_tho","Hey tech/infosec twitter :\n\nDo I know anyone who works at twitter HQ? Or do you know someone who works at twitter H… https://t.co/ZKHCUPY9rA",""
"@MaiteOrtegaCSO","The Canada CyberSlide features some of the most innovative cybersecurity companies in Canada:… https://t.co/9uqtlbm1jU",""
"@MarceloRivero","#LockDown #Ransomware \n\n- New extension: .sext\n- Note: HELP_DECRYPT_YOUR_FILES.txt\n- Email: getyourdata@protonmail[… https://t.co/4Eg9fvQwO6","@protonmail"
"@three_cube","Automobile Hacking, Part 2: the canutils or SOCKETCAN\n#carhacking #autohacking #cybersecurity #cyberwarrior… https://t.co/BOKEitXFYX",""
"@Tecnoblog","STJ teria sido vítima de ransomware; Ministério da Saúde sofre ataque https://t.co/nZK86bLkJk",""
"@THT_Resmi","Sanal gerçeklikle el hareketlerinin kullanımı!\n\nİlgini çektiyse yorumlarda arkadaşlarını etiketleyebilirsin!… https://t.co/bqRh2YNarO",""
"@three_cube","Getting Started with Kali Linux 2020 #kali #linux #cybersecurity #hacking #cyberwarrior\n\nhttps://t.co/Tm0m9aB87E https://t.co/xeLIrkVBkp",""
"@ProbCause","Yooo my twitter account was hacked, I just got it back but is the second time I’ve been hacked in the last 2 weeks… https://t.co/JqfUnV5Qwh",""
"@malwrhunterteam","The Ragnar Locker ransomware samples used in these cases were not only signed, but was signed with the same cert... https://t.co/IP41o10dL3",""
"@xerusdesign","Now we wait to see iOS 14.2 CVE entries 👀 🤞\n\n#FreeTheSandbox",""
"@cfiesler","This seemed like a good week to do a fun in-class activity. So here are the results of this semester's… https://t.co/lC2Hk2l1jD",""
"@InsanityIsFree","""I'm not an audio engineer, but here's my opinion about Raycon.""\n\n""I have no cybersecurity expertise, but here's Th… https://t.co/zYOXxDV08D",""
"@antoniosanzalc","Si hace poco decíamos que los ******* de Ryuk pasaban de 23 a 5h... ahora en 2h  https://t.co/ysRfB3lx01 Si no te q… https://t.co/U2Nvq4ByRu",""
"@lucaslago","Palpitando sobre as notícias dos ataques ao STJ.\n\n1) As poucas informações que temos indicam que foi um ataque de r… https://t.co/0ZSxE4U29D",""
"@Shubham_pen","Today in this article, we’ll learn one of the most important burpsuite’s extensions i.e. XSS Validator, which there… https://t.co/76l6eCNjIZ",""
"@JMonteagudoE","The Mexico CyberSlide features some of the most innovative cybersecurity companies in Mexico:… https://t.co/mmF9eDjNMD",""
"@CamilleEsq","A big thank you to @AfroTech &amp; Shanique for this feature! \n\nCybersecurity is very human-focused where everyone has… https://t.co/cZW4942oBV","@AfroTech"
"@virustotal","How to minimize being a ransomware victim? Our advice: keep your friens close; keep ransomware closer, by… https://t.co/CPQkz68xnT",""
"@AlyssaM_InfoSec","So I guess I lucked out. Apparently since this was a pre-procedure test and I'm not showing any symptoms, they didn… https://t.co/962XjtpPya",""
"@dfaranha","Estou novamente de férias do tema urna eletrônica, se cuidem e vão ler sobre o ransomware do STJ que pelo menos é novidade.",""
"@camillemoura","ransomware no STJ: a\n\ngalera de proteção de dados e cybersec que há anos é solenemente ignorada ao alertar sobre fr… https://t.co/acYL6EQfE3",""
"@HPI_NYC","🚀 🎓 Apply now for the following Master's programs starting in summer semester 2021 at @HPI_DE in Potsdam, Germany!… https://t.co/9TQ0LE0o0a","@HPI_DE"
"@CyberSecOb","The US CyberSlide - Product features some of the most innovative cybersecurity companies in the US:… https://t.co/wS2W1IyQ2k",""
"@USCERT_gov","Don’t give an attacker the opportunity to take over your system—apply Cisco’s latest security updates!… https://t.co/43H3J2wRwD",""
"@DrJDrooghaag","🔵 Part 2 of the conversation with @BillMew on James Bond, Cyber Security and mass surveillance.\n\n👉… https://t.co/yw1xfgp9RC","@BillMew"
"@CyberNews_com","#CyberNews #E12: Maze retires, ransomware goes up, and Chrome's zero-days. Let’s see what’s new in the cybersecurit… https://t.co/lG2AVpZKWF",""
"@owasp","An infosec job can leave us feeling frustrated, tired, isolated and/or unwell. A high percentage of us are vulnerab… https://t.co/adgsADTcxO",""
"@IlonaSzaboC","STJ, e aparentemente também CNJ, dataSUS e outros órgãos públicos sob grande ataque cibernético (ransomware). https://t.co/5JkPOOUHwt",""
"@moixsec","As Maze retires, clients turn to Sekhmet ransomware spin-off Egregor https://t.co/jpSMBd8yDV #cybersecurity… https://t.co/zm39wogZja",""
"@rubenrcabrera","The reports generated by a penetration test provide the necessary feedback for an organization to prioritize its se… https://t.co/3EEWgfgRSM",""
"@desirevile","Hungry for Success may be fatal V/@cedric_o cc:#TOI #gamedev #indiedev #socialmedia #cybersecurity #Manali… https://t.co/mcunPXxmKD","@cedric_o"
"@UCxUP","Holy faking fakk... benci bgt gua sama ransomware ajg https://t.co/9WDvFnKehe",""
"@felipepayao","Ao que parece, ransomware confirmado. https://t.co/XHtmi3QxEk",""
"@GedoYouth","@GedoYouth in collaboration with Dolow district Police have today carried out a beautification volunteer activities… https://t.co/9E0vdFZOvh","@GedoYouth"
"@NOVAPresKress","Did you know that @Steppingblocks found @NOVAcommcollege is the #5 college (2 or 4 year) in the country for high ea… https://t.co/omVJWb19rR","@Steppingblocks|@NOVAcommcollege"
"@rafa_zanatta","The issue is not new though: “The attack shined a spotlight on the digital vulnerabilities of the judicial branch,… https://t.co/DipBeiw5MN",""
"@jmckenny","Interesting new study from the World Economic Forum highlighting tech jobs rising in demand by 2025 - analytics,… https://t.co/1U8Smet86W",""
"@malwrhunterteam","And @malwrhunterteam and probably many other researchers too. The only difference is that (at least for us) we not… https://t.co/4cNunah4Iv","@malwrhunterteam"
